<?xml version="1.0" encoding="UTF-8" standalone="yes"?>
<!--
 [y] hybris Platform

 Copyright (c) 2018 SAP SE or an SAP affiliate company. All rights reserved.

 This software is the confidential and proprietary information of SAP
 ("Confidential Information"). You shall not disclose such Confidential
 Information and shall use it only in accordance with the terms of the
 license agreement you entered into with SAP.
-->
<audit-report-config name="userAddressCountry" xmlns:xsi="http://www.w3.org/2001/XMLSchema-instance"
                     xsi:noNamespaceSchemaLocation="../audit/audit.xsd">
	<given-root-type>User</given-root-type>
	<types>
		<type code="User" displayName="User">
			<atomic-attributes>
				<atomic-attribute qualifier="name" displayName="name"/>
				<atomic-attribute qualifier="uid" displayName="uid"/>
			</atomic-attributes>
			<virtual-attributes>
				<virtual-attribute expression="owner" type="Address" many="true" displayName="owned addresses"/>
			</virtual-attributes>
		</type>

		<type code="Address">
			<atomic-attributes>
				<atomic-attribute qualifier="streetname" displayName="street"/>
			</atomic-attributes>
			<reference-attributes>
				<reference-attribute qualifier="country" displayName="country" type="Country"/>
				<reference-attribute qualifier="region" displayName="region" type="Region"/>
			</reference-attributes>
		</type>


		<type code="Country">
			<atomic-attributes>
				<atomic-attribute qualifier="isocode" displayName="isocode"/>
				<atomic-attribute qualifier="name" displayName="name"/>
			</atomic-attributes>
			<!--<reference-attributes>-->
				<!--<attribute qualifier="regions" displayName="regions" type="Region"/>-->
			<!--</reference-attributes>-->
			<virtual-attributes>
				<virtual-attribute expression="country" type="Region" many="true" displayName="regions"/>
			</virtual-attributes>
		</type>

		<type code="Region">
			<atomic-attributes>
				<atomic-attribute qualifier="isocode" displayName="isocode"/>
				<atomic-attribute qualifier="name" displayName="name"/>
			</atomic-attributes>
		</type>
	</types>
</audit-report-config>
